{
  "story_id": "STORY001",
  "title": "ギルド冒険物語",
  "premise": "身分を隠した王子が仲間を集め、王都奪還を目指す。",
  "themes": ["王とは何か", "民を知る", "責任"],
  "ending_goal": "宰相の魔王復活を阻止し王都を奪還する",
  "chapters": [
    {
      "order": 1,
      "title": "平原の章",
      "theme": "王とは何か",
      "summary": "近衛騎士団への入隊と王都襲撃。",
      "boss": "オークキング",
      "characters": ["主人公", "レオン", "ヴァルグ"],
      "joins": ["レオン"],
      "milestones": ["黒の結晶を発見"],
      "locked_fields": ["theme", "boss"]
    }
  ]
}
