{
  "story_id": "STORY_GUILD_ADVENTURE",
  "title": "ギルド冒険物語",
  "premise": "身分を隠して近衛騎士団へ入った王子が、宰相の策謀で追われながら各地の仲間と反抗勢力を集め、魔王復活を阻止して王都奪還を目指す。",
  "themes": ["王とは何か", "民を知る", "責任", "選択", "連帯", "正統", "覚醒", "結束", "対峙", "王"],
  "ending_goal": "宰相による魔王復活を阻止し、王都を奪還する。",
  "source_format": "GK_MAIN_SCENARIO_MANAGEMENT_V1",
  "chapters": [
    {"chapter_id":"CH001","order":1,"title":"平原の章","theme":"王とは何か","summary":"王子は身分を隠して近衛騎士団へ入り、王都襲撃後の平原でレオンと行動する。黒の結晶を発見し、オークキングを討つ。","boss":"オークキング","characters":["主人公","レオン","ヴァルグ"],"joins":["レオン"],"milestones":["黒の結晶を発見","オークキング討伐"],"locked_fields":["theme","boss"]},
    {"chapter_id":"CH002","order":2,"title":"森林の章","theme":"民を知る","summary":"森林で魔物凶暴化の原因が黒の結晶だと判明する。リーファと協力し、トレントエルダーを討つ。","boss":"トレントエルダー","characters":["主人公","レオン","リーファ"],"joins":["リーファ"],"milestones":["黒の結晶が凶暴化原因と判明","トレントエルダー討伐"],"locked_fields":["theme","boss"]},
    {"chapter_id":"CH003","order":3,"title":"山岳の章","theme":"責任","summary":"追われる一行は山岳へ逃れ、ガルドの協力で装備整備と武器供給を確保する。エリシアが加入する。","characters":["主人公","レオン","リーファ","エリシア","ガルド"],"joins":["エリシア"],"milestones":["ガルドと協力関係を構築","装備整備と武器供給を確保","エリシア加入"]},
    {"chapter_id":"CH004","order":4,"title":"海域の章","theme":"選択","summary":"追手を避けるため船を入手し、海域を進む。セリアと協力して暴走クラーケンを討つ。","boss":"クラーケン","characters":["主人公","レオン","リーファ","エリシア","セリア"],"joins":["セリア"],"milestones":["追手回避用の船を入手","クラーケン討伐"],"locked_fields":["theme","boss"]},
    {"chapter_id":"CH005","order":5,"title":"交易の章","theme":"連帯","summary":"交易都市でナディアと協力提携を結び、カインとフレアが仲間に加わる。","characters":["主人公","レオン","リーファ","エリシア","セリア","カイン","フレア","ナディア"],"joins":["カイン","フレア"],"milestones":["ナディアと協力提携","カイン加入","フレア加入"]},
    {"chapter_id":"CH006","order":6,"title":"領主の章","theme":"正統","summary":"地方領主ハインツと接触し、王妃の居場所を知る。主人公は身分を公開するが、王妃救出はまだ行わない。","characters":["主人公","ハインツ"],"milestones":["ハインツと協力関係を構築","王妃の居場所判明","主人公の身分公開"]},
    {"chapter_id":"CH007","order":7,"title":"瘴気の章","theme":"覚醒","summary":"魔族領域へ進む準備の中、エリシアが覚醒し瘴気を解除できるようになる。","characters":["主人公","エリシア"],"milestones":["エリシア覚醒","瘴気解除能力を獲得"],"locked_fields":["theme"]},
    {"chapter_id":"CH008","order":8,"title":"集結の章","theme":"結束","summary":"各地で得た協力者と反抗勢力を集結させ、王都奪還に向けて統合する。","characters":["主人公","ヴァルグ","ガルド","ナディア","ハインツ"],"milestones":["反抗勢力を統合","王都奪還作戦を確立"]},
    {"chapter_id":"CH009","order":9,"title":"魔域の章","theme":"対峙","summary":"魔族領域を攻略し、囚われていた王妃を救出する。","characters":["主人公","王妃"],"milestones":["魔族領域攻略","王妃救出"],"locked_fields":["theme"]},
    {"chapter_id":"CH010","order":10,"title":"王都奪還の章","theme":"王","summary":"王都へ進攻し、宰相との決戦で魔王復活を阻止して王都を奪還する。","characters":["主人公","宰相"],"milestones":["宰相との決戦","魔王復活阻止","王都奪還"],"locked_fields":["theme"]}
  ]
}
